{
  "typeName": "Smithy::TestService::Read",
  "description": "Definition of Smithy::TestService::Read Resource Type",
  "properties": {
    "CreatedAt": {
      "type": "string",
      "format": "date-time"
    },
    "FooId": {
      "type": "string"
    },
    "UpdatedAt": {
      "type": "string",
      "format": "date-time"
    }
  },
  "readOnlyProperties": [
    "/properties/CreatedAt",
    "/properties/FooId",
    "/properties/UpdatedAt"
  ],
  "primaryIdentifier": [
    "/properties/FooId"
  ],
  "handlers": {
    "read": {
      "permissions": [
        "testservice:GetFoo"
      ]
    }
  },
  "additionalProperties": false
}
