{
  "typeName": "Smithy::TestService::PutResource",
  "description": "Definition of Smithy::TestService::PutResource Resource Type",
  "properties": {
    "BarProperty": {
      "type": "string"
    },
    "FooId": {
      "type": "string"
    },
    "Tags": {
      "type": "array",
      "items": {
        "type": "string"
      }
    }
  },
  "createOnlyProperties": [
    "/properties/FooId"
  ],
  "primaryIdentifier": [
    "/properties/FooId"
  ],
  "handlers": {
    "create": {
      "permissions": [
        "testservice:PutFoo"
      ]
    },
    "update": {
      "permissions": [
        "testservice:PutFoo"
      ]
    }
  },
  "additionalProperties": false
}
