{
  "typeName": "Smithy::TestService::Full",
  "description": "Definition of Smithy::TestService::Full Resource Type",
  "properties": {
    "BarProperty": {
      "type": "string"
    },
    "FooId": {
      "type": "string"
    },
    "Tags": {
      "type": "array",
      "items": {
        "type": "string"
      }
    }
  },
  "readOnlyProperties": [
    "/properties/FooId"
  ],
  "primaryIdentifier": [
    "/properties/FooId"
  ],
  "handlers": {
    "create": {
      "permissions": [
        "testservice:CreateFoo"
      ]
    }
  },
  "additionalProperties": false
}
